Title,Genre,Length
Ang Alamat ng Gunting,Alamat,Short
Ang Alamat ng Kawali,Alamat,Short
Ang Alamat ng Mesa,Alamat,Short
Ang Alamat ng Silya,Alamat,Short
Ang Alamat ng Lapis,Alamat,Short
Ang Alamat ng Papel,Alamat,Short
Ang Alamat ng Kutsara,Alamat,Short
Ang Alamat ng Kandila,Alamat,Short
Ang Alamat ng Banga,Alamat,Short
Ang Alamat ng Salamin,Alamat,Short
Ang Alamat ng Orasan,Alamat,Short
Ang Alamat ng Panyo,Alamat,Short
Ang Alamat ng Barya,Alamat,Short
Ang Alamat ng Tasa,Alamat,Short
Ang Alamat ng Sapatos,Alamat,Short
Ang Alamat ng Kaldero,Alamat,Short
Ang Alamat ng Hagdan,Alamat,Short
Ang Alamat ng Lamesa,Alamat,Short
Ang Alamat ng Kuwaderno,Alamat,Short
Ang Alamat ng Pluma,Alamat,Short
Ang Alamat ng Timbangan,Alamat,Short
Ang Alamat ng Payong,Alamat,Short
Ang Alamat ng Salamin,Alamat,Short
Ang Alamat ng Orasan,Alamat,Short
Ang Alamat ng Pako,Alamat,Short
Ang Alamat ng Pintuan,Alamat,Short
Ang Alamat ng Kurtina,Alamat,Short
Ang Alamat ng Silya,Alamat,Short
Ang Alamat ng Pangkulay,Alamat,Short
Ang Alamat ng Pindutan,Alamat,Short
Ang Alamat ng Baso,Alamat,Short
Ang Alamat ng Pitaka,Alamat,Short
Ang Alamat ng Palamuti,Alamat,Short
Ang Alamat ng Pluma,Alamat,Short
Ang Alamat ng Bumbilya,Alamat,Short
Ang Mapagmataas na Palaka,Pabula,Short
Ang Matulunging Daga,Pabula,Short
Ang Maingat na Suso,Pabula,Short
Ang Mapanlinlang na Pagong,Pabula,Short
Ang Mabait na Langgam,Pabula,Short
Ang Malikhain at Tamad na Pato,Pabula,Short
Ang Mapagmahal na Tigre,Pabula,Short
Ang Masiglang Alitaptap,Pabula,Short
Ang Malakas at Mapanlinlang na Hangin,Pabula,Short
Ang Maalalahaning Kalapati,Pabula,Short
Ang Masipag na Gagamba,Pabula,Short
Ang Masayahing Bubuyog,Pabula,Short
Ang Mapagbigay na Kalabaw,Pabula,Short
Ang Matapang na Tutubi,Pabula,Short
Ang Mahilig sa Papuri na Agila,Pabula,Short
Ang Matapat na Tupa,Pabula,Short
Ang Masayahing Pagong,Pabula,Short
Ang Magandang Boses ng Kwago,Pabula,Short
Ang Matatag na Kawayan,Pabula,Short
Ang Palalong Pechay,Pabula,Short
Ang Madiskarteng Pagong,Pabula,Short
Ang Masiglang Palaka,Pabula,Short
Ang Matapat na Daga,Pabula,Short
Ang Masigasig na Langgam,Pabula,Short
Ang Mahinhin na Bulaklak,Pabula,Short
Ang Pusang Mahilig Magsalita,Pabula,Short
Ang Mabait na Usa,Pabula,Short
Ang Mapagmalaking Tipaklong,Pabula,Short
Ang Masayahing Pagong,Pabula,Short
Ang Uhaw na Kalapati,Pabula,Short
Ang Maingat na Matsing,Pabula,Short
Ang Mapagbigay na Uwak,Pabula,Short
Ang Mapagmahal na Bituin,Pabula,Short
Ang Matapang na Gagamba,Pabula,Short
Ang Mapagpanggap na Palaka,Pabula,Short
Ang Masinop na Pagong,Pabula,Short
Ang Matapat na Kalabaw,Pabula,Short
Ang Maalalahaning Bubuyog,Pabula,Short
Ang Tapat na Kabayo,Pabula,Short
Ang Mapagbigay na Daga,Pabula,Short
Ang Masinop na Palaka,Pabula,Short
Ang Makasariling Usa,Pabula,Short
Ang Masipag na Palaka,Pabula,Short
Ang Matapang na Alitaptap,Pabula,Short
Ang Matapat na Tupa,Pabula,Short
Ang Makasariling Kabibe,Pabula,Short
Ang Ambisyosong Suso,Pabula,Short
Ang Palalong Agila,Pabula,Short
Ang Masayahing Langgam,Pabula,Short
Ang Maingat na Pusa,Pabula,Short
Ang Mabait na Buwaya,Pabula,Short
Ang Tapat na Matsing,Pabula,Short
Ang Mapagpakumbabang Kalabaw,Pabula,Short
Ang Mapagmataas na Pagong,Pabula,Short
Ang Masipag na Kalapati,Pabula,Short
Ang Matapang na Uod,Pabula,Short
Ang Matapat na Palaka,Pabula,Short
Ang Mabuting Lobo,Pabula,Short
Ang Mapagbigay na Tigre,Pabula,Short
Ang Matalinong Pagong,Pabula,Short
Ang Masiglang Kuneho,Pabula,Short
Ang Matapat na Alitaptap,Pabula,Short
Ang Mapagkalingang Kalapati,Pabula,Short
Ang Matapang na Bibe,Pabula,Short
Ang Mapagbigay na Usa,Pabula,Short
Ang Magiliw na Aso,Pabula,Short
Ang Masiglang Gagamba,Pabula,Short
Ang Mapanlikhang Matsing,Pabula,Short
Ang Mabait na Tigre,Pabula,Short
Ang Maingat na Pusa,Pabula,Short
Ang Masigasig na Langgam,Pabula,Short
Ang Matapat na Kabayo,Pabula,Short
Ang Mapanlikhang Gansa,Pabula,Short
Ang Masipag na Palaka,Pabula,Short
Ang Matulunging Paruparo,Pabula,Short
Ang Mapanlikhang Kalabaw,Pabula,Short
Ang Maingat na Soro,Pabula,Short
Ang Mabait na Tupa,Pabula,Short
Ang Masikap na Pagong,Pabula,Short
Ang Maalalahaning Loro,Pabula,Short
Ang Matalinong Palaka,Pabula,Short
Ang Magiliw na Usa,Pabula,Short
Ang Mapagparayang Tagak,Pabula,Short
Ang Mapagbigay na Tupa,Pabula,Short
Ang Maingat na Tipaklong,Pabula,Short
Ang Matapat na Gansa,Pabula,Short
Ang Masigasig na Alitaptap,Pabula,Short
Ang Matapat na Aso,Pabula,Short
Ang Mapagpasensyang Bibe,Pabula,Short
Ang Maingat na Bayawak,Pabula,Short
Ang Masigasig na Daga,Pabula,Short
Ang Masayahing Kabayo,Pabula,Short
Ang Mapanlikhang Unggoy,Pabula,Short
Ang Matulunging Kalapati,Pabula,Short
Ang Matapat na Kuwago,Pabula,Short
Ang Matapang na Palaka,Pabula,Short
Ang Mapagkumbabang Kalabaw,Pabula,Short
Ang Masiyahing Maya,Pabula,Short
Ang Matulunging Pagong,Pabula,Short
Ang Matapat na Alitaptap,Pabula,Short
Ang Matutulunging Magkakaibigan,Pabula,Short
Ang Mapanlikhang Ardilya,Pabula,Short
Ang Mapagkalingang Tigre,Pabula,Short
Ang Masipag na Lamok,Pabula,Short
Ang Maparaan na Pagong,Pabula,Short
Ang Mapagbigay na Kambing,Pabula,Short
Ang Mabuting Pusa,Pabula,Short
Ang Matapang na Tuko,Pabula,Short
Ang Magalang na Sisiw,Pabula,Short
Ang Masikap na Tipaklong,Pabula,Short
Ang Alamat ng Araw at Buwan,Alamat,Short
Ang Alamat ng Bahaghari,Alamat,Short
Ang Alamat ng Mga Bituin,Alamat,Short
Ang Alamat ng Ulap,Alamat,Short
Ang Alamat ng Bahay Kubo,Alamat,Short
Ang Alamat ng Kidlat at Kulog,Alamat,Short
Ang Alamat ng Palasyo sa Ulap,Alamat,Short
Ang Alamat ng Buwan at Tala,Alamat,Long
Ang Alamat ng Sapatos,Alamat,Long
Ang Alamat ng Liwanag ng Parol,Alamat,Long
Ang Alamat ng Kalendaryo,Alamat,Long
Ang Alamat ng Bakya,Alamat,Long
Ang Alamat ng Bentilador,Alamat,Long
Ang Alamat ng Lapis,Alamat,Short
Ang Alamat ng Tsinelas,Alamat,Long
Ang Alamat ng Payong,Alamat,Short
Ang Alamat ng Palasyo,Alamat,Short
Ang Alamat ng Papel,Alamat,Short
Ang Alamat ng Bintana,Alamat,Short
Ang Alamat ng Salamin,Alamat,Short
Ang Alamat ng Hapag-Kainan,Alamat,Short
Ang Alamat ng Bangko,Alamat,Short
Ang Alamat ng Batingaw,Alamat,Short
Ang Alamat ng Pluma,Alamat,Short
Ang Alamat ng Silya,Alamat,Short
Ang Alamat ng Palito,Alamat,Short
Ang Alamat ng Bintana,Alamat,Short
Ang Alamat ng Kawali,Alamat,Short
Ang Alamat ng Kalamansi,Alamat,Short
Ang Alamat ng Timbangan,Alamat,Short
Ang Alamat ng Kandila,Alamat,Short
Ang Alamat ng Tsinelas,Alamat,Short
Ang Alamat ng Batya,Alamat,Short
Ang Alamat ng Papel,Alamat,Short
Ang Alamat ng Kutsara,Alamat,Short
Ang Alamat ng Salamin,Alamat,Short
Ang Alamat ng Payong,Alamat,Short
Ang Alamat ng Lapis,Alamat,Short
Ang Alamat ng Bangko,Alamat,Short
Ang Alamat ng Orasan,Alamat,Short
Ang Alamat ng Timbangan,Alamat,Short
Ang Alamat ng Bubong,Alamat,Short
Ang Alamat ng Pluma,Alamat,Short
Ang Alamat ng Tigre,Alamat,Short
Ang Alamat ng Kabayo,Alamat,Short
Ang Alamat ng Pagong,Alamat,Short
Ang Alamat ng Matsing,Alamat,Short
Ang Alamat ng Alitaptap,Alamat,Short
Ang Alamat ng Buwaya,Alamat,Short
Ang Alamat ng Kalabaw,Alamat,Short
Ang Alamat ng Ahas,Alamat,Short
Ang Alamat ng Paru-paro,Alamat,Short
Ang Alamat ng Gagamba,Alamat,Short
Ang Alamat ng Palaka,Alamat,Short
Ang Alamat ng Pusa,Alamat,Short
Ang Alamat ng Ibon,Alamat,Short
Ang Mapagpasensyang Langgam,Pabula,Short
Ang Matapat na Kalapati,Pabula,Short
Ang Matalinong Pagong at ang Alamid,Pabula,Short
Ang Mapagkalingang Palaka at ang Gagamba,Pabula,Short
Ang Mabait na Usa at ang Galit na Lobo,Pabula,Short
Ang Magiliw na Alitaptap,Pabula,Short
Ang Mapagpatawad na Elepante,Pabula,Long
Ang Matapang na Maya at ang Ahas,Pabula,Short
Ang Matulunging Kabayo,Pabula,Short
Ang Masayahing Paruparo at ang Malungkot na Uod,Pabula,Short
Ang Masipag na Kuneho at ang Batugan na Pagong,Pabula,Short
Ang Palaboy na Tandang at ang Masipag na Manok,Pabula,Long
Ang Mapagmahal na Usa at ang Magulang na Tigre,Pabula,Long
Ang Makulit na Unggoy at ang Matapang na Pagong,Pabula,Long
Ang Masayahing Paruparo at ang Malungkot na Bubuyog,Pabula,Long
Ang Mapagmalaking Alitaptap at ang Lamok,Pabula,Long
Ang Matapat na Bibe at ang Tuso na Matsing,Pabula,Long
Ang Mapanlinlang na Aso at ang Maingat na Tupa,Pabula,Long
Ang Mabait na Uwak at ang Palaging Naaawa sa Sarili na Pagong,Pabula,Long
Ang Mayabang na Kabayo at ang Mabait na Kambing,Pabula,Long
Ang Mainggitin na Tipaklong at ang Masipag na Langgam,Pabula,Long
Ang Pabigat na Pagong at ang Maingat na Tagak,Pabula,Short
Ang Mapanlinlang na Daga at ang Tapat na Kalapati,Pabula,Long
Ang Hangin at ang Mapagmataas na Kawayan,Pabula,Short
Ang Makasariling Usa at ang Mapagbigay na Kalabaw,Pabula,Short
Ang Matapang na Suso at ang Mapangutyaing Palaka,Pabula,Short
Ang Masayahing Kabayo at ang Malungkuting Kambing,Pabula,Short
Ang Mapanlikhang Gansa at ang Mainggitin na Manok,Pabula,Short
Ang Matapat na Pusa at ang Tuso ngunit Tamad na Aso,Pabula,Short
Ang Mapagmalasakit na Pagong at ang Mapagmataas na Ibon,Pabula,Short
Ang Tapat na Alitaptap at ang Mayabang na Lamok,Pabula,Short
Ang Magiliw na Usa at ang Mainggitin na Baboy Damo,Pabula,Short
Ang Mataktik na Kalabaw at ang Pasaway na Unggoy,Pabula,Short
Ang Masipag na Langgam at ang Tamad na Tipaklong,Pabula,Short
Ang Mahinahong Pagong at ang Magagalitin na Alimango,Pabula,Short
Ang Mapagpakumbabang Bibe at ang Mapagmalaking Gansa,Pabula,Short
Ang Mabait na Kabayo at ang Supladong Aso,Pabula,Short
Ang Marunong na Matsing at ang Matakaw na Kuneho,Pabula,Short
Ang Matapat na Paruparo at ang Tusong Tipaklong,Pabula,Short
Ang Maalagaing Pusa at ang Magulong Ibon,Pabula,Short
Ang Kalabaw at ang Baka,Pabula,Short
Ang Leon at ang Usa,Pabula,Short
Ang Gansa at ang Manok,Pabula,Short
Ang Palaka at ang Alitaptap,Pabula,Short
Ang Ahas at ang Tuko,Pabula,Short
Ang Pusa at ang Daga,Pabula,Short
Ang Palaka at ang Isda,Pabula,Short
Ang Gagamba at ang Tipaklong,Pabula,Short
Ang Bibe at ang Palaka,Pabula,Short
Ang Matsing at ang Kabayo,Pabula,Short
Ang Alamat ng Agila,Alamat,Long
Ang Alamat ng Paniki,Alamat,Long
Ang Alamat ng Alimango,Alamat,Long
Ang Alamat ng Kabayo,Alamat,Long
Ang Alamat ng Lobo,Alamat,Long
Ang Alamat ng Paru-paro,Alamat,Long
Ang Alamat ng Kalapati,Alamat,Long
Ang Alamat ng Pagong,Alamat,Long
Ang Alamat ng Tipaklong,Alamat,Long
Ang Alamat ng Alitaptap,Alamat,Long
Ang Alamat ng Gagamba,Alamat,Short
Ang Alamat ng Kabayo,Alamat,Short
Ang Alamat ng Tuko,Alamat,Short
Ang Alamat ng Langgam,Alamat,Short
Ang Alamat ng Payong,Alamat,Short
Ang Alamat ng Bituin,Alamat,Short
Ang Alamat ng Palaka,Alamat,Short
Ang Alamat ng Bulaklak,Alamat,Short
Ang Alamat ng Kandila,Alamat,Long
Ang Alamat ng Tambol,Alamat,Short
Ang Alamat ng Papel na Bangka,Alamat,Short
Ang Alamat ng Manggang Hilaw,Alamat,Short
Ang Alamat ng Kulay ng Bahaghari,Alamat,Short
Ang Alamat ng Ulan ng Kendi,Alamat,Short
Ang Alamat ng Talismanong Kawayan,Alamat,Short
Ang Alamat ng Luhang Perlas,Alamat,Short
Ang Alamat ng Gintong Himpapawid,Alamat,Short
Ang Alamat ng Pagong na Ginto,Alamat,Short
Ang Alamat ng Bulaklak na Parol,Alamat,Short
Ang Alamat ng Puting Ahas,Alamat,Short
Ang Alamat ng Ulap na Yakap,Alamat,Short
Ang Alamat ng Hatinggabi,Alamat,Short
Ang Alamat ng Asin,Alamat,Short
Ang Alamat ng Kulay Rosas,Alamat,Short
Ang Alamat ng Malaking Buwan,Alamat,Short
Ang Alamat ng Bakunawa,Alamat,Short
Ang Alamat ng Lasonang Bulaklak,Alamat,Short
Ang Alamat ng Araw at Hangin,Alamat,Short
"Ang Alamat ng Bahagharing Bato",Alamat,Long
Ang Alamat ng Puno ng Dalandan,Alamat,Long
Ang Masipag na Langgam at ang Mayabang na Tipaklong,Pabula,Short
Ang Mabait na Kabayo at ang Sakim na Aso,Pabula,Short
Ang Matsing at ang Aso,Pabula,Short
Ang Mabait na Bibe at ang Pabigat na Palaka,Pabula,Short
Ang Masipag na Langgam at ang Mayabang na Tipaklong,Pabula,Short
Ang Mabait na Kabayo at ang Sakim na Aso,Pabula,Short
Ang Matsing at ang Aso,Pabula,Short
Ang Mabait na Bibe at ang Pabigat na Palaka,Pabula,Short
Ang Gutom na Lobo at ang Mabuting Kambing,Pabula,Long
Ang Mabait na Kalapati at ang Mapagkunwaring Pusa,Pabula,Short
Ang Unggoy at ang Palaka,Pabula,Short
Ang Tikling at ang Mayabang na Kalapati,Pabula,Short
Ang Maingat na Usa at ang Tuso na Tigre,Pabula,Long
Ang Mabait na Butiki at ang Mainggitin na Gagamba,Pabula,Short
Ang Mayabang na Bibe at ang Mabuting Isda,Pabula,Short
Ang Mapanlinlang na Aso at ang Mabuting Kuneho,Pabula,Short
Ang Mapagmataas na Kabayo at ang Mapagpakumbabang Kalabaw,Pabula,Long
Ang Maingat na Pagong at ang Pabiglang Usa,Pabula,Short
Ang Mapagmalaking Palaka at ang Tahimik na Alitaptap,Pabula,Short
Ang Tuso na Soro at ang Masipag na Langgam,Pabula,Short
Ang Matapang na Pagong at ang Tuso na Kalabaw,Pabula,Long
Ang Matalas na Matsing at ang Mapagmataas na Kalapati,Pabula,Short
Ang Mabait na Daga at ang Mapanlinlang na Pusa,Pabula,Short
Ang Mahinahon na Palaka at ang Maingay na Gansa,Pabula,Short
Ang Masikap na Sisiw at ang Tamad na Tandang,Pabula,Short
Ang Maingat na Kuneho at ang Mapagmataas na Loro,Pabula,Short
Ang Mabuting Uwak at ang Ganid na Tupa,Pabula,Short
Ang Mapagpasensyang Lamok at ang Nagmamadaling Langaw,Pabula,Short
Ang Tahimik na Palaka at ang Mayabang na Alitaptap,Pabula,Short
Ang Matapat na Kabayo at ang Palalo na Kambing,Pabula,Short
Ang Mapanlikhang Pagong at ang Mapang-aping Agila,Pabula,Short
Ang Maingat na Usa at ang Mapusok na Baboy Ramo,Pabula,Short
Ang Mahinahon na Kalabaw at ang Magagalitin na Kalapati,Pabula,Long
Ang Masipag na Pagong at ang Tamad na Daga,Pabula,Short
Ang Maparaan na Pusa at ang Magarbo na Lawin,Pabula,Short
Ang Mapagkumbabang Gansa at ang Mapagmalaking Bibe,Pabula,Short
Ang Masayahing Bubuyog at ang Malungkot na Paru-Paro,Pabula,Short
Ang Matapat na Kalapati at ang Mapang-abusong Uwak,Pabula,Short
Ang Mapagpakumbabang Usa at ang Hambog na Tigre,Pabula,Short
Ang Masipag na Langgam at ang Tamad na Tipaklong,Pabula,Short
Ang Alamat ng Mabait na Alitaptap,Alamat,Short
Ang Alamat ng Bahaghari,Alamat,Short
Ang Alamat ng Palaka,Alamat,Short
Ang Alamat ng Sampaguita,Alamat,Short
Si Juan at ang Dakilang Bato,Kwentong Bayan,Short
Ang Tatlong Magkakapatid,Kwentong Bayan,Short
Si Mang Isko at ang Kalabaw,Kwentong Bayan,Short
Si Juana at ang Balong Mahiwaga,Kwentong Bayan,Short
Si Juan at ang Punong Mangga,Kwentong Bayan,Short
Si Maria at ang Palayok ng Ginto,Kwentong Bayan,Short
Ang Alitaptap at ang Tipaklong,Kwentong Bayan,Short
Si Lola Basyang at ang Kabayo,Kwentong Bayan,Short
Si Juan Tamad at ang Isang Libong Buto,Kwentong Bayan,Short
Si Mariang Makiling at ang Nawawalang Alahas,Kwentong Bayan,Short
Ang Kwento ni Pedro at ang Nawawalang Kabayo,Kwentong Bayan,Long
Si Tikboy at ang Mahiwagang Palasyo,Kwentong Bayan,Long
Ang Matalinong Hatol ni Datu Ibarra,Kwentong Bayan,Long
Ang Mahiwagang Tikbalang ng Gubat,Kwentong Bayan,Long
Ang Nawawalang Kampanilya ng Baryo,Kwentong Bayan,Long
Si Andoy at ang Higanteng Bato,Kwentong Bayan,Long
Si Kaloy at ang Tatlong Bangkang Kahoy,Kwentong Bayan,Long
Ang Mahiwagang Pagong ng Isla Verde,Kwentong Bayan,Long
Ang Alamat ng Matandang Kawayan,Kwentong Bayan,Long
Si Nita at ang Mahiwagang Punong Mangga,Kwentong Bayan,Long
Si Pedro at ang Mahiwagang Palasong Ginto,Kwentong Bayan,Long
Ang Tatlong Kahilingan ni Mila,Kwentong Bayan,Long
Ang Masipag na Kalabaw,Kwentong Bayan,Long
Si Luningning at ang Diwata ng Bundok,Kwentong Bayan,Long
Ang Mahiwagang Banga,Kwentong Bayan,Long
Si Andoy at ang Higanteng Kabibe,Kwentong Bayan,Long
Ang Matalinong Usa,Kwentong Bayan,Long
Si Karyo at ang Lumang Kampana,Kwentong Bayan,Long
Ang Lihim ng Araw at Buwan,Kwentong Bayan,Long
Ang Matapat na Alitaptap,Kwentong Bayan,Long
Ang Mahiwagang Gansa,Kwentong Bayan,Long
Ang Prinsipe at ang Mahiwagang Kalapati,Kwentong Bayan,Long
Ang Batang Masipag sa Gubat,Kwentong Bayan,Long
Ang Matandang Punong Narra,Kwentong Bayan,Long
Ang Pagong at ang Matigas na Ulo,Kwentong Bayan,Long
Ang Mabait na Higante,Kwentong Bayan,Long
Ang Diwata ng Bundok Kanlaon,Kwentong Bayan,Long
Si Pedro at ang Kalabasa,Kwentong Bayan,Long
Ang Matigas na Ulo ni Mang Kardo,Kwentong Bayan,Long
Ang Nawawalang Palayok na Ginto,Kwentong Bayan,Long
Ang Pag-aaway ng Araw at Buwan,Kwentong Bayan,Long
Si Mariang Sinukuan at ang Nawawalang Kayamanan,Kwentong Bayan,Long
Si Alon at ang Laging Bagyong Hangin,Pabula,Long
Si Juan at ang Puno ng Kamatis,Kwentong Bayan,Long
Si Bibo at ang Taong Mabait,Pabula,Long
Si Juan at ang Pag-aalaga ng Kamote,Kwentong Bayan,Long
Si Lando at ang Malupit na Ulan,Kwentong Bayan,Long
Si Pagong at ang Agila,Pabula,Long
Si Liza at ang Alamat ng Ilog,Kwentong Bayan,Long
Si Tomas at ang Swerte ng Puno ng Mangga,Kwentong Bayan,Long
Si Kiko at ang Pagtulong sa Bahay ng ibang Tao,Kwentong Bayan,Long
Si Andres at ang Puno ng Kasaysayan,Kwentong Bayan,Long
Ang Alamat ng Bayabas,Alamat,Short
Ang Alamat ng Sampalok,Alamat,Short
Ang Alamat ng Pakwan,Alamat,Short
Ang Alamat ng Papaya,Alamat,Short
Ang Alamat ng Durian,Alamat,Short
Ang Alamat ng Mangga,Alamat,Long
Ang Alamat ng Santol,Alamat,Short
Ang Alamat ng Saging,Alamat,Short
Ang Alamat ng Pinya,Alamat,Short
Ang Alamat ng Pakwan,Alamat,Short
Ang Alamat ng Kalabasa,Alamat,Short
Ang Alamat ng Mais,Alamat,Short
Ang Alamat ng Talong,Alamat,Short
Ang Alamat ng Langka,Alamat,Short
Ang Alamat ng Kamatis,Alamat,Short
Ang Alamat ng Kakaw,Alamat,Short
Ang Alamat ng Saging,Alamat,Short
Ang Alamat ng Sampaguita,Alamat,Short
Ang Alamat ng Siling Labuyo,Alamat,Short
Ang Alamat ng Palay,Alamat,Short
Ang Alamat ng Anahaw,Alamat,Short
Ang Alamat ng Yantok,Alamat,Short
Ang Alamat ng Makahiya,Alamat,Short
Ang Alamat ng Mangga,Alamat,Short
Ang Alamat ng Puso ng Saging,Alamat,Short
Ang Alamat ng Dalampasigan,Alamat,Short
Ang Alamat ng Kangkong,Alamat,Short
Ang Alamat ng Bituin,Alamat,Short
Ang Alamat ng Kabibe,Alamat,Short
Ang Alamat ng Bayabas,Alamat,Short
Ang Alamat ng Sampaguita,Alamat,Short
Ang Alamat ng Kawayan,Alamat,Short
Ang Alamat ng Bahaghari,Alamat,Short
Ang Alamat ng Mangga,Alamat,Short
Ang Alamat ng Mayon,Alamat,Short
Ang Alamat ng Palay,Alamat,Short
Ang Alamat ng Puso ng Saging,Alamat,Short
Ang Alamat ng Tsokolate,Alamat,Short
Ang Alamat ng Pating,Alamat,Short
Ang Alamat ng Lawa ng Sampalok,Alamat,Short
Ang Alamat ng Ginto,Alamat,Short
Ang Alamat ng Pagong,Alamat,Short
Ang Alamat ng Kabibe,Alamat,Long
Ang Alamat ng Bundok Makiling,Alamat,Short
Ang Alamat ng Bahaghari,Alamat,Long
Ang Alamat ng Uwak,Alamat,Short
Ang Alamat ng Buwan,Alamat,Long
Ang Alamat ng Sampaguita,Alamat,Short
Ang Alamat ng Kawayan,Alamat,Short
Ang Alamat ng Talon,Alamat,Long
Ang Alamat ng Saging,Alamat,Short
Ang Alamat ng Gintong Palay,Alamat,Short
Ang Maingat na Pagong at ang Padalos-dalos na Kuneho,Pabula,Long
Ang Matalinong Loro at ang Mapang-aping Matsing,Pabula,Long
Ang Mabait na Kambing at ang Sakim na Baboy,Pabula,Short
Ang Mapagmahal na Aso at ang Selosong Pusa,Pabula,Short
Ang Mapanlikhang Daga at ang Madaling Sumuko na Pusa,Pabula,Short
Ang Masigasig na Gansa at ang Tuwang-tuwang Gato,Pabula,Short
Ang Mapagkalingang Baka at ang Mapanirang Kambing,Pabula,Short
Ang Palaka at ang Magarbo niyang Kuliglig,Pabula,Short
Ang Matalas na Soro at ang Mapagmataas na Pabo,Pabula,Short
Ang Masipag na Langgam at ang Tamad na Tipaklong,Pabula,Short
Ang Tusong Gansa at ang Walang Pag-aalalang Kalabaw,Pabula,Short
Ang Mapagbigay na Usa at ang Makasariling Ardilya,Pabula,Short
Ang Maingat na Pagong at ang Mapusok na Aso,Pabula,Short
Ang Magkaibigang Kabayo at Kalapati,Pabula,Short
Ang Masipag na Maya at ang Tamad na Lawin,Pabula,Short
Ang Mapagbigay na Kuneho at ang Makasariling Loro,Pabula,Short
Ang Matalinong Matsing at ang Hangal na Baboy,Pabula,Short
Ang Mapagmahal na Bibe at ang Pasaway na Gansa,Pabula,Short
Ang Masikap na Gagamba at ang Tamad na Alitaptap,Pabula,Short
Ang Mabait na Usa at ang Mapanlinlang na Ahas,Pabula,Short
Ang Mapagkumbabang Kalapati at ang Mapangmataas na Lawin,Pabula,Short
Ang Tusong Matsing at ang Tamad na Pagong,Pabula,Short
Ang Matapat na Aso at ang Sakim na Pusa,Pabula,Long
Ang Mabagal na Pagong at ang Pilosopong Paru-Paro,Pabula,Short
Ang Masigasig na Langgam at ang Magarbong Tipaklong,Pabula,Short
Ang Tapat na Gansa at ang Tuso nitong Kaibigang Soro,Pabula,Short
Ang Matapang na Dagang Bukid at ang Mayabang na Pusa,Pabula,Short
Ang Tatlong Baboy,Pabula,Long
Ang Matsing at ang Pagong,Pabula,Long
Ang Pato at ang Palaka,Pabula,Short
Ang Leon at ang Daga,Pabula,Short
Ang Aso at ang Kalabaw,Pabula,Short
Ang Aso at ang Uwak,Pabula,Short
Ang Kuneho at ang Tigre,Pabula,Long
Ang Gansa at ang Palaka,Pabula,Short
Ang Alitaptap at ang Tipaklong,Pabula,Short
Ang Matsing at ang Pagong,Pabula,Long
Ang Langgam at ang Tipaklong,Pabula,Short
Ang Pusa at ang Daga,Pabula,Short
Ang Bibe at ang Gansa,Pabula,Short
Ang Leon at ang Daga,Pabula,Short
Ang Tuko at ang Alitaptap,Pabula,Short
Ang Gansa at ang Aso,Pabula,Short
Ang Palaka at ang Baka,Pabula,Short
Ang Matalinong Matsing,Pabula,Short
Ang Bahaghari sa Itaas ng Bundok,Kwentong Bayan,Long
Ang Lihim ng Makahiya,Kwentong Bayan,Short
Ang Alamat ng Mahabang Gabi,Alamat,Short
Ang Dalawang Kaibigan sa Gubat,Pabula,Long
Ang Tatlong Magkaibigan,Kwentong Bayan,Short
Si Mang Isko at ang Kuweba,Kwentong Bayan,Short
Ang Nawawalang Gong,Kwentong Bayan,Short
Ang Sikreto ng Matandang Balon,Kwentong Bayan,Short
Ang Matalas na Pandayan,Kwentong Bayan,Short
Ang Araw ng Pasasalamat,Kwentong Bayan,Short
Ang Nawawalang Sandok,Kwentong Bayan,Short
Ang Duyan sa Punong Acacia,Kwentong Bayan,Short
Ang Palasyo sa Ilalim ng Lawa,Kwentong Bayan,Short
Ang Pitong Palayok,Kwentong Bayan,Short
Ang Paglalakbay ni Anding,Kwentong Bayan,Short
Ang Aklat ng Kagubatan,Kwentong Bayan,Short
Si Juan at ang Mahiwagang Banga,Kwentong Bayan,Short
Ang Nawawalang Kampana,Kwentong Bayan,Short
Ang Dalawang Panahon ng Bundok,Kwentong Bayan,Short
Ang Mahiyain na Higante,Kwentong Bayan,Short
Ang Alamat ng Kawayan,Kwentong Bayan,Short
Ang Mahika ng Lumang Sapatos,Kwentong Bayan,Short
Ang Mahiwagang Alamat ng Bukal,Kwentong Bayan,Short
Ang Matalinong Siopao,Kwentong Bayan,Short
Ang Nawawalang Lantaka,Kwentong Bayan,Short
Ang Palaka at ang Balon,Kwentong Bayan,Short
Ang Kuwento ng Bulaklak ng Yelo,Kwentong Bayan,Short
Ang Susi ng Kalikasan,Kwentong Bayan,Short
Ang Alingawngaw ng Kuweba,Kwentong Bayan,Short
Ang Gintong Kalabaw,Kwentong Bayan,Short
Ang Matalinong Pagong,Kwentong Bayan,Short
Ang Lihim ng Lumang Gulong,Kwentong Bayan,Short
Ang Alitaptap at ang Dilim,Kwentong Bayan,Short
Ang Nawawalang Paru-Paro,Kwentong Bayan,Short
Ang Batang Mandirigma,Kwentong Bayan,Short
Ang Puno ng mga Pangarap,Kwentong Bayan,Short
Ang Dalawang Magkaibang Daan,Kwentong Bayan,Short
Ang Misteryo ng Lumang Tulay,Kwentong Bayan,Short
Ang Mahusay na Bangkero,Kwentong Bayan,Short
Ang Palasyo sa Buhangin,Kwentong Bayan,Short
Ang Alitaptap na Nawawala,Kwentong Bayan,Short
Ang Mahiwagang Banga,Kwentong Bayan,Short
Ang Dalaga sa Tabing-Dagat,Kwentong Bayan,Short
Ang Luntiang Punong Bahaghari,Kwentong Bayan,Short
Ang Lihim ng Bundok Karunungan,Kwentong Bayan,Short
Ang Nawawalang Kaldero,Kwentong Bayan,Short
Ang Nawawalang Kahon,Kwentong Bayan,Short
Ang Lihim ng Mahabang Tulay,Kwentong Bayan,Short
Ang Manggagawang Masipag,Kwentong Bayan,Short
Ang Dalaga at ang Kuwintas,Kwentong Bayan,Short
Ang Matandang May Lihim,Kwentong Bayan,Short
Ang Kalabaw na Walang Gulong,Kwentong Bayan,Short
Ang Kabataang Matapang,Kwentong Bayan,Short
Ang Pangarap ni Maria,Kwentong Bayan,Short
Ang Karpintero at ang Pader,Kwentong Bayan,Short
Ang Gintong Pako,Kwentong Bayan,Short
Ang Dalaga sa Sampung Banga,Kwentong Bayan,Short
Ang Pamilya ng Gilingan,Kwentong Bayan,Short
Ang Mahiyain na Batang Guro,Kwentong Bayan,Short
Ang Palayok sa Lupa,Kwentong Bayan,Short
Ang Sulo ng Pag-asa,Kwentong Bayan,Short
Ang Gintong Pangako,Kwentong Bayan,Short
Ang Nawalang Kampana,Kwentong Bayan,Short
Ang Alamat ng Sampung Daan,Kwentong Bayan,Short
Ang Lihim ng Lumang Balon,Kwentong Bayan,Short
Ang Pangarap ni Tomas,Kwentong Bayan,Short
Ang Mga Butong Naiinggit,Kwentong Bayan,Short
Ang Lumang Tambol,Kwentong Bayan,Short
Ang Sikreto ng Batong Bughaw,Kwentong Bayan,Short
Ang Puno ng Pag-asa,Kwentong Bayan,Long
Ang Dalawang Kapitbahay,Kwentong Bayan,Short
Ang Kuwento ng Bakawan,Kwentong Bayan,Short
Ang Palasyo ng Hangin,Kwentong Bayan,Short
Ang Pista ng Pagtutulungan,Kwentong Bayan,Short
Ang Lihim ng Matandang Tulay,Kwentong Bayan,Short
Ang Nawawalang Banga,Kwentong Bayan,Short
Ang Kuwento ng Maliit na Balon,Kwentong Bayan,Short
Ang Dakilang Halaman,Kwentong Bayan,Short
Ang Karera ng Kalabaw,Kwentong Bayan,Short
Ang Lumang Bahay sa Gulod,Kwentong Bayan,Short
Ang Alamat ng Bulaklak ng Pagkakaisa,Kwentong Bayan,Short
Ang Bahay na Ginto,Kwentong Bayan,Short
Ang Lihim ng Talisay,Kwentong Bayan,Short
Ang Kariton ni Tatay Ben,Kwentong Bayan,Short
Ang Malaking Banga sa Plaza,Kwentong Bayan,Short
Ang Palaro ng Bayan,Kwentong Bayan,Short
Ang Kuwento ng Mapagkalingang Aplaya,Kwentong Bayan,Short
Ang Bahay sa Dulo ng Baryo,Kwentong Bayan,Short
Ang Paligsahan sa Pagtatanim,Kwentong Bayan,Short
Ang Paglalakbay ni Lino,Kwentong Bayan,Short
Ang Kuwento ng Sampung Banga,Kwentong Bayan,Short
Ang Puno ng Pag-asa,Kwentong Bayan,Short
Ang Kabalyero at ang Baryo,Kwentong Bayan,Short
Ang Nawawalang Kampana,Kwentong Bayan,Short
Ang Kuwento ng Tatlong Balon,Kwentong Bayan,Short
Ang Kahon ng Mga Alaala,Kwentong Bayan,Short
Ang Kariton ni Mang Pilo,Kwentong Bayan,Short
Ang Mahabang Lakbay ni Andoy,Kwentong Bayan,Short
Ang Bakuran ng Ligaya,Kwentong Bayan,Short
Ang Piging ni Kapitana Sabel,Kwentong Bayan,Short
Ang Talisman ng Kabutihan,Kwentong Bayan,Short
Ang Susi sa Lumang Bahay,Kwentong Bayan,Short
