Title,Genre,Length
Ang Puno ng Hiwaga sa Bundok Lantay,Kwentong Bayan,Long
Ang Lihim ng Masasayang Ibon,Kwentong Bayan,Long
Ang Nawawalang Kuwento ni Tita Dalisay,Kwentong Bayan,Long
Ang Paglalakbay ng Batang Si Mila,Kwentong Bayan,Long
Ang Alamat ng Araw at Buwan,Alamat,Long
Ang Bakas ng Tatlong Mandirigma,Kwentong Bayan,Long
Si Lino at ang Mahiwagang Punso,Kwentong Bayan,Long
Ang Halimaw sa Gubat ng Sigwa,Kwentong Bayan,Long
Ang Lihim ng Masalimuot na Isla,Kwentong Bayan,Long
Ang Nawawalang Bituin sa Langit,Kwentong Bayan,Long
Si Mang Isko at ang Paglalakbay sa Dagat ng mga Alon,Kwentong Bayan,Long
Ang Prinsipeng Uhaw sa Kaalaman,Kwentong Bayan,Long
Ang Nawawalang Korona ng Hari,Kwentong Bayan,Long
Ang Alamat ng Puno ng Ugnayan,Alamat,Long
Ang Sikretong Lungsod sa Ilalim ng Tubig,Alamat,Long
Ang Sumpa ng Kuweba ng Liwanag,Kwentong Bayan,Long
Ang Alamat ng Sirenang Naghanap ng Hangin,Alamat,Long
Ang Mga Kabalyero ng Ilog ng Dugo,Kwentong Bayan,Long
Ang Nawawalang Korona ng Hari ng Hangin,Kwentong Bayan,Long
Ang Puno ng Buhay at ang Bituin,Alamat,Long
Ang Karera ng Tigre at ng Hangin,Pabula,Long
Ang Mahiwagang Balon ng Pag-asa,Alamat,Long
Ang Lihim ng Gintong Ubas,Kwentong Bayan,Long
Si Kiko at ang Halimaw sa Karagatan,Kwentong Bayan,Long
Ang Sikreto ng Matandang Kawayan,Alamat,Long
Ang Alamat ng Palasong Bagyo,Alamat,Long
Ang Misteryo ng Kalangitang Umiiyak,Kwentong Bayan,Long
Ang Lihim ng Batis ng Diwata,Kwentong Bayan,Long
Ang Bituing Nahulog sa Lupa,Kwentong Bayan,Long
Ang Mandaragat at ang Prinsesa ng Dagat,Kwentong Bayan,Long
Ang Alamat ng Isdang Ginto,Alamat,Long
Si Maita at ang Alitaptap,Kwentong Bayan,Long
Ang Lihim ng Tatlong Bahaghari,Alamat,Long
Ang Batang Nagtanim ng Bituin,Kwentong Bayan,Long
Ang Alamat ng mga Bulaklak ng Ulap,Alamat,Long
Ang Nawawalang Bato ng Talon,Kwentong Bayan,Long
Ang Hiwaga ng Luntiang Ahas,Kwentong Bayan,Long
Si Andoy at ang Mahiwagang Sungka,Kwentong Bayan,Long
Ang Alamat ng Bahagharing Lawa,Alamat,Long
Ang Prinsesa at ang Bulaklak ng Liwanag,Alamat,Long
Si Bakunawa at ang Nawawalang Buwan,Kwentong Bayan,Long
Ang Alamat ng Puntod ng Kabayo,Alamat,Long
Ang Araw na Nawawala,Kwentong Bayan,Long
Ang Susi ng Kabundukan,Alamat,Long
Ang Mahiwagang Bato ni Itay,Kwentong Bayan,Long
Ang Kuwento ng Nawawalang Gintong Susi,Alamat,Long
Ang Diwatang Nawala ang Pakpak,Kwentong Bayan,Long
Ang Paglalakbay ng Tatlong Kaibigan,Kwentong Bayan,Long
Ang Lihim ng Bato ni Liwanag,Alamat,Long
Ang Sirena at ang Nawawalang Dagat,Kwentong Bayan,Long
Ang Mahiwagang Singsing ni Tala,Kwentong Bayan,Long
Ang Prinsipe ng Kabilugan,Kwentong Bayan,Long
Ang Puno ng Buhay,Kwentong Bayan,Long
Ang Mahiwagang Alitaptap,Pabula,Long
Ang Paghahanap ni Toto sa Lihim ng Bahaghari,Kwentong Bayan,Long
Ang Alamat ng Niyog,Alamat,Long
Si Kiko at ang Mahiwagang Bituin,Kwentong Bayan,Long
Ang Misteryo ng Nawawalang Bituin,Kwentong Bayan,Long
Ang Lihim ng Lumilipad na Bituin,Kwentong Bayan,Long
Ang Alamat ng Itim na Pusa,Alamat,Long
Ang Himala ng Bulaklak ng Laging Pagsasama,Alamat,Long
Ang Alamat ng Kawayang Sumayaw,Alamat,Long
Ang Mahika ng Puno ng Araw,Kwentong Bayan,Long
Ang Alamat ng mga Makukulay na Lobo,Alamat,Long
Ang Pagtuklas ni Luna sa Bituin,Kwentong Bayan,Long
Ang Pagsasama ng mga Hayop at Tao,Kwentong Bayan,Long
Ang Tadhana ni Maya at ng Kiting,Kwentong Bayan,Long
Ang Kakaibang Alon sa Dagat,Kwentong Bayan,Long
Ang Mahiwagang Bunga,Kwentong Bayan,Long
Ang Kuweba ng mga Pangarap,Kwentong Bayan,Long
Ang Hiwaga ng Bulaklak na Itim,Kwentong Bayan,Long
Ang Batang Naglaro sa Buwan,Kwentong Bayan,Long
Ang Lihim ng Bituin,Kwentong Bayan,Long
Ang Gintong Isda,Kwentong Bayan,Long
Ang Alamat ng Makulay na Kalesa,Alamat,Long
Ang Kahalagahan ng Mithi,Kwentong Bayan,Long
Ang Alaga ni Mang Juan,Kwentong Bayan,Long
Ang Misteryo ng Nakatagong Yaman,Kwentong Bayan,Long
Sino ang Tunay na Bayani ng Kagubatan?,Pabula,Long
Paano Naging Kulay Pula ang Dahon ng Langka?,Kwentong Bayan,Long
Bakit Hindi na Lumipad si Alon ang Lawin?,Pabula,Long
Bakit Matinik ang Rosas?,Alamat,Long
Bakit Asul ang Langit?,Kwentong Bayan,Long
Bakit May Bahaghari Pagkatapos ng Ulan?,Pabula,Long
Bakit Maingay ang Kulog?,Kwentong Bayan,Short
Bakit Lumilipad ang Paruparo?,Pabula,Long
Bakit Dumadami ang mga Bituin?,Kwentong Bayan,Long
Bakit Mahiyain ang Buwan?,Kwentong Bayan,Long
Bakit May Apoy ang mga Bulkan?,Kwentong Bayan,Long
Bakit Kulay Lila ang Talong?,Pabula,Short
Bakit Matamis ang Mangga?,Pabula,Long
Bakit Maraming Mata ang Alitaptap?,Pabula,Long
Bakit Makulay ang Bahaghari?,Pabula,Long
Bakit Matinik ang Rosas?,Alamat,Short
Bakit May Bituin sa Langit?,Alamat,Long
Bakit Maalat ang Dagat?,Alamat,Short
Bakit Hindi Marunong Lumipad ang Pagong?,Alamat,Long
Bakit May Kaliskis ang Isda?,Alamat,Long
Bakit Maingay ang Tandang sa Umaga?,Alamat,Long
Bakit Matalino ang Matsing?,Alamat,Long
Bakit Mabaho ang Durian?,Alamat,Long
Bakit Nagkukulay Ginto ang Dahon?,Alamat,Short
Bakit May Sungay ang Kalabaw?,Alamat,Short
Bakit Mabagal ang Pagong?,Alamat,Short
Bakit Parang Umaawit ang Ilog?,Alamat,Long
Bakit May Mata ang Buwan?,Alamat,Short
Bakit Malamig ang Hangin sa Bundok?,Alamat,Long
Bakit Masipag ang Langgam?,Alamat,Short
Bakit Marunong Lumipad ang Alitaptap?,Alamat,Long
Saan Nanggaling ang Bahaghari?,Alamat,Long
Saan Nagmula ang mga Bituin?,Alamat,Long
Saan Nakatira ang Araw?,Alamat,Long
Saan Nagtatago ang Hangin?,Alamat,Long
Saan Naglalaro ang mga Kuliglig?,Alamat,Short
Bakit Hindi Marunong Lumipad ang Pagong?,Alamat,Long
Paano Naging Makulay ang Paruparo?,Alamat,Long
Bakit Mahilig Sumayaw ang Kawayan?,Alamat,Long
Paano Natutong Umawit ang Ibon?,Pabula,Short
Bakit May Kulisap tuwing Gabi?,Alamat,Short
Bakit Hindi Natutulog ang Buwan?,Kwentong Bayan,Long
Paano Nagkaroon ng Kulay ang Bahaghari?,Pabula,Long
Bakit May Mga Alon sa Dagat?,Pabula,Short
Paano Naging Pula ang Palaka?,Pabula,Long
Bakit May Liwanag ang Gabi?,Pabula,Short
Paano Nakakalipad ang Saranggola?,Pabula,Short
Si Tonton at ang Nawawalang Bituin,Pabula,Long
Ang Pabigat na Sumbrero ni Pedro,Pabula,Long
Si Andoy at ang Matandang Puno,Pabula,Long
 Ang Lihim ng Banga ni Aling Marta,Kwentong Bayan,Long
Ang Paglalakbay ni Inoy sa Kabundukan,Pabula,Long
Si Layla at ang Matandang Kutsara,Pabula,Long
Ang Aso at ang Batang Si Nino,pabula,Long
Ang Mahalagang Susi ni Rosa,Pabula,Long
Ang Pagkakaibigan ni Miko at ang Maya,Pabula,Long
Ang Maliit na Pananim ni Lira,Pabula,Long
Ang Lihim ng Matandang Puno,Pabula,Long
Ang Sikreto ng Palaka,Pabula,Long
 Ang Masipag na Langgam,Pabula,Long
Ang Alitaptap at ang Paruparo,Pabula,Long
Ang Pangarap ni Carlo,Pabula,Long
Ang Alamat ng Bulaklak ng Pag-ibig,Alamat,Long
Ang Butil ng Palay,Pabula,Long
Ang Matalinong Uwak,Pabula,Long
Ang Tapat na Aso ni Lando,Pabula,Long
Ang Kabutihan ni Nita,Pabula,Long
Ang Kuwintas ni Aling Rosa,Pabula,Long
Ang Sikreto ng mga Bituin,Pabula,Long
Ang Magkakaibigang Tsinelas,Pabula,Long
Ang Lihim ng Sanga,Pabula,Long
 Ang Puno ng Pag-asa,Pabula,Long
Ang Munting Guhit,Pabula,Long
Ang Bituin sa Ilalim ng Tubig,Pabula,Long
Ang Alon ng Pag-asa,Pabula,Long
Ang Alon at ang Bituin,Pabula,Long
Ang Mahiwagang Bulaklak,Pabula,Long
Ang Mahiwagang Buho ng Kawayan,Pabula,Long
Si Pipay at ang Nawawalang Bituin,Pabula,Long
Ang Sikretong Isla ng Pagong,Pabula,Long
Ang Alamat ng Puno ng Ginto,Alamat,Long
Si Bulaklak at ang Mahika ng Puno ng Saging,Pabula,Long
Si Tala at ang Mahiwagang Palasyo sa Buwan,Pabula,Long
Ang Matapang na Musang at ang Bundok ng Buhangin,Pabula,Long
Ang Prinsesa ng Karagatan at ang Nawawalang Korona,Pabula,Long
Si Ading at ang Batong Nagliliwanag,Pabula,Long
Ang Aso at ang Nawawalang Takure,Pabula,Long
Si Lira at ang Mga Bulaklak ng Lupa,Pabula,Long
Ang Lihim ni Mutya at ang Diwata ng Bukid,Pabula,Long
Si Ambo at ang Itim na Kabayo ng Hatinggabi,Pabula,Long
Ang Mahiwagang Perlas ni Kaloy,Pabula,Long
Si Nilo at ang Ibon ng Pag-asa,Pabula,Long
Ang Lihim ng Tagalupa at ang Sirena ng Lawa,Pabula,Long
Si Mila at ang Alamat ng Gintong Butil,Alamat,Long
Ang Pitong Bahaghari ni Alon,Pabula,Long
Ang Palaro ni Kaliwa at Kanan,Pabula,Long
Si Adan at ang Nag-aapoy na Gubat,Kwentong Bayan,Long
Si Laya at ang Mahiwagang Parol,Pabula,Long
Si Ina at ang Malaking Buwan,Pabula,Long
Ang Alamat ng Makulay na Lobo,Alamat,Long
Si Tala at ang Araw ng mga Gintong Alon,Pabula,Long
Ang Munting Payaso at ang Nawalang Tawa,Pabula,Long
Si Leon at ang Mahiwagang Bato,Pabula,Long
Ang Palaka at ang Bulalakaw,Pabula,Long
Ang Sapatos ni Lila,Pabula,Long
Si Carlo at ang Mga Lihim ng Ulap,Pabula,Long
Ang Mahiwagang Punong-Kawayan,Pabula,Long
Si Kiko at ang Nawawalang Kalabaw,Pabula,Long
Ang Lumilipad na Bahay ni Lola Biring,Pabula,Long
Ang Pagong at ang Bituin,Pabula,Short
Ang Mahiwagang Kuwintas ni Maya,Pabula,Long
Ang Prinsesang Ayaw sa Korona,Pabula,Long
Ang Kwento ng Bituing Hinulog,Alamat,Long
Ang Masayahing Layak,Pabula,Long
Ang Araw at ang Buwan,Pabula,Long
Si Tino at ang Puno ng Kahel,Pabula,Long
Ang Sirenang Nawawala ang Boses,Pabula,Long
Ang Alitaptap at ang Pagpapakumbaba,Pabula,Long
Ang Munting Talahib na Nagnanais Maging Malaking Puno,Pabula,Long
Ang Batang Lobo na Nais Maging Tao,Pabula,Long
Ang Kapatid ng Liwanag,Pabula,Long
Ang Paglalakbay ni Lito sa Ulan,Pabula,Long
Si Iya at ang Kulay ng Kalikasan,Pabula,Long
Ang Lihim ni Haring Lamok,Pabula,Long
Ang Bituin sa Likod ng Araw,Pabula,Long
Ang Nawawalang Pakpak ni Kiko,Pabula,Long
Si Lila at ang Lihim ng Dagat,Pabula,Long
Ang Magkaibang Mundo ni Paco at Gino,Pabula,Long
Ang Araw na Hindi Lumubog,Kwentong Bayan,Long
Ang Mahiwagang Alamat ng Kweba ng Hangin,Alamat,Long
Ang Bulaklak na Nagsasalita,Pabula,Long
Ang Mahiwagang Silid ng Bahaghari,Pabula,Long
Ang Lihim ni Kuya Paniki,Pabula,Long
Ang Takipsilim na Pangako ni Anya,Pabula,Long
Ang Munting Prinsesa ng Lawa,Pabula,Long
Ang Hiwaga ng Lumang Sinturon,Pabula,Long
Ang Batang Lumilipad,Pabula,Long
Ang Palaka at ang Nawawalang Tubig,Pabula,Long
Ang Kuwento ng Mahiwagang Kampana,Pabula,Short
Si Sisiw at ang Bato ng Karunungan,Pabula,Short
Ang Mahiwagang Bunga ng Puno ng Silangan,Kwentong Bayan,Long
Si Pio at ang Mga Bagwis ng Hangin,Pabula,Long
Ang Bituin ni Tala,Pabula,Long
Ang Pangarap ni Aling Daga,Pabula,Short
Ang Batang Maharlika at ang Araw ng Kapayapaan,Pabula,Long
Ang Lihim ng Bahagharing Bulaklak,Pabula,Long
Si Lino at ang Nawawalang Sigaw,Pabula,Long
Ang Alamat ng Dalawang Mundo,Alamat,Long
Si Kiko at ang Mahiwagang Layag,Pabula,Long
Ang Kabayo at ang Gintong Ulan,Pabula,Long
Ang Hiwagang Ngiti ng Buwan,Pabula,Short
Si Arman at ang Kalasag ng Gubat,Pabula,Short
Ang Diwata ng Kawayan,Pabula,Long
Si Pinpin at ang Nawawalang Kulay ng Bahaghari,Pabula,Long
Ang Kabayong Maalat,Pabula,Short
Ang Matang Nagliliwanag,Pabula,Short
Ang Mahiwagang Layang-layang,Pabula,Short
Ang Alitaptap na Nagbigay-Liwanag,Pabula,Short
Ang Susi ng Kalikasan,Pabula,Short
Si Lila at ang Bahay sa Buwan,Pabula,Short
Ang Aklat na Naglalaro ng Hangin,Pabula,Long
Ang Mahiwagang Isda sa Ilalim ng Dagat,Pabula,Long
Si Lino at ang Bituing Nahulog,Pabula,Long
Ang Lihim ng Bulaklak na Ginto,Pabula,Short
Ang Haring Bakawan,Pabula,Short
Ang Nawawalang Kulay ng Bahaghari,Pabula,Short
Ang Mahiwagang Kwaderno ni Nilo,Pabula,Short
Si Pilak at ang Paboritong Bituin,Pabula,Short
Ang Paglalakbay ni Kaloy at ng Hangin,Pabula,Long
Ang Bulaklak na Nagbigay-Buhay,Pabula,Short
Ang Mahiwagang Sungay ni Dino,Pabula,Short
Ang Prinsesang Natutulog sa Mga Ulap,Pabula,Long
Si Kuting at ang Nawawalang Laro,Pabula,Short
Ang Kabayong Kulay-Langit,Pabula,Long
Ang Puno ng Pag-asa ni Tala,Pabula,Short
Ang Liwanag ng Munting Alitaptap,Pabula,Short
Ang Mahiwagang Bahaghari ni Alon,Pabula,Short
Ang Palaka at ang Lawa ng mga Pangarap,Pabula,Long
Ang Mahiwagang Pakpak ni Yana,Pabula,Long
Ang Alamat ng Bituing Araw,Alamat,Short
Ang Mahiwagang Baso ni Marco,Pabula,Long
Ang Kunehong Hinahangin,Pabula,Short
Si Luntian at ang Mahiwagang Kabibe,Pabula,Short
Ang Alitaptap na May Mahabang Pakpak,Pabula,Long
Ang Mahiwagang Singsing ni Adan,Pabula,Long
Ang Batang Araw at ang Sanggol na Buwan,Pabula,Long
"Ang Kwento ni Simang, ang Munting Tagapagligtas",Pabula,Short
Si Migo at ang Mahiwagang Bandana,Pabula,Long
Ang Mahiwagang Kahon ni Maya,Pabula,Long
Ang Prinsesang Naghahanap ng Kulay,Pabula,Long
Ang Paglalakbay ni Pilo at ang Aklat ng Kaalaman,Pabula,Long
Ang Munting Alon ng Dagat,Pabula,Long
Ang Alamat ng Tatlong Bituin,Alamat,Long
Ang Kabayong Naghahanap ng Tunog ng Hangin,Pabula,Long
Si Patpat at ang Mahiwagang Payong,Pabula,Long
Ang Kuwento ng Nawawalang Palasyo,Pabula,Long
Ang Batang Manlalakbay ng mga Bundok ng Ulan,Pabula,Long
Ang Isang Daang Bulaklak ni Laya,Pabula,Long
Si Kiko at ang Nawawalang Bituin,Pabula,Long
Ang Tindahan ng Laro ni Tonton,Pabula,Long
Si Tina at ang Mga Himig ng Kagubatan,Pabula,Long
Ang Araw na Nawawala ang Araw,Pabula,Long
Ang Mahiwagang Sapatos ni Lola Sisa,Pabula,Long
Ang Paglalakbay ni Lino sa Lupa ng Ulap,Pabula,Long
Si Tonton at ang Puno ng Hangin,Pabula,Long
Ang Kwento ng Tatlong Kulay ng Kalangitan,Alamat,Long
Ang Mahiwagang Pato ni Ambo,Pabula,Long
Ang Lihim ng Bahagharing Walang Kulay,Pabula,Long
Ang Nawawalang Alaga ni Karla,Pabula,Long
Si Lando at ang Alamat ng Batong Buhay,Alamat,Long
Ang Prinsesang Mahilig Magtanong,Pabula,Long
Ang Sikreto ng Batis ng Pag-asa,Pabula,Long
Ang Araw na Nawawala sa Lupa ng Gabi,Pabula,Long
Si Marikit at ang Kaharian ng Ulan,Pabula,Long
Ang Lihim ng Matandang Balon,Pabula,Long
Si Maya at ang Misteryo ng Bulaklak na Walang Kulay,Pabula,Long
Ang Bata at ang Takot na Dilim,Pabula,Long
Si Miko at ang Alamat ng Bato ng Hangin,Alamat,Short
Ang Mahiwagang Payong ni Lola Sima,Pabula,Long
Ang Batang Bituin,Pabula,Long
Ang Paglalakbay ni Pepito sa Kaharian ng Ginto,Pabula,Long
Si Mina at ang Kaibigan niyang Anino,Pabula,Long
Ang Alamat ng Puno ng Buwan,Alamat,Long
Ang Paglalakbay ni Iñigo sa Puno ng Hangin,Pabula,Long
Ang Munting Kabayo ni Berto,Pabula,Long
Ang Susi ni Lila,Pabula,Long
Ang Alamat ng Hiwagang Gabi,Alamat,Long
Ang Batang Naghahanap ng Bahaghari,Pabula,Long
Ang Tindahan ni Mang Pilo,Pabula,Long
Si Amihan at ang Bulaklak ng Hangi,Pabula,Short
Ang Nawawalang Kulay ni Maya,Pabula,Long
Ang Lihim ni Daga,Pabula,Long
Ang Kuwintas ng mga Bituin,Pabula,Short
Ang Halaman na Nagsasalita,Pabula,Long
Si Pili at ang Mahiwagang Lapis,Pabula,Long
Ang Puno ng Karamay,Pabula,Long
Si Toti at ang Araw ng Paglipad,Pabula,Long
Ang Alamat ng Batang Ulap,Alamat,Short
Ang Mahiwagang Tambol ni Lira,Pabula,Long
Si Pilo at ang Lihim ng Malaking Bundok,Pabula,Long
"Ang Kuwento ni Asul, ang Mahiwagang Palaka",Pabula,Long
Ang Batang Gawa sa Sinulid,Pabula,Long
Ang Laruang Bote ni Domi,Pabula,Short
Ang Mahiwagang Suso sa Ilog,Pabula,Long
Ang Alitaptap na si Tala,Pabula,Short
Si Basti at ang Gintong Bangkang Papel,Pabula,Short
Ang Susi ng Isang Kahon ng mga Pangarap,Pabula,Long
Si Mina at ang Buwan ng mga Hiling,Pabula,Long
Ang Sumpa ni Nilo at ang Araw ng mga Kaha,Pabula,Long
Si Tonio at ang Bulaklak ng Hangin,Pabula,Long
Ang Kaibigang Bato ni Berto,Pabula,Long
Ang Mahiwagang Alamat ng Kulay sa Karagatan,Alamat,Long
Si Mateo at ang Nawawalang Pakpak ng Anghel,Pabula,Long
Ang Hiwaga ng Punong Kakaibang Bunga,Kwentong Bayan,Long
Ang Mahiwagang Takip-Silim ng Bundok Mayapa,Kwentong Bayan,Long
Si Ivo at ang Nawawalang Tunog ng Kalikasan,Pabula,Long
Ang Araw na Naging Buwan si Mimi,Pabula,Long
Ang Mga Bituin sa Ilalim ng Tubig,Pabula,Long
Ang Lihim ni Anya at ang Mga Bulaklak ng Gabi,Pabula,Long
Ang Puno ng mga Pangarap ni Inoy,Pabula,Long
Ang Araw na Naging Itim ang Langit,Pabula,Short
Ang Mahiwagang Lawa ni Maya,Pabula,Short
Si Carlo at ang Prinsipeng Ginintuang Ibon,Pabula,Short
Ang Mahiwagang Susi ni Kiko,Pabula,Long
Ang Kahon ng Kaalaman ni Nita,Pabula,Short
Ang Alamat ng Bahagharing Ibon,Alamat,Short
Ang Paglalakbay ni Lino sa Mundo ng Mga Anino,Kwentong Bayan,Short
Si Pepe at ang Mahiwagang Barya,Pabula,Short
Ang Mahiwagang Sapatos ni Tonton,Pabula,Long
Ang Paglalakbay ni Pilar sa Bundok ng Ulap,Pabula,Long
Ang Nawawalang Kulay ng Bahaghari,Pabula,Long
Ang Isang Kahariang Nakalimot sa Musika,Pabula,Short
Ang Prinsesa at ang Bituing Nahulog sa Lupa,Pabula,Short
Ang Mahiwagang Bisikleta ni Dodi,Pabula,Long
Ang Batang May Pakpak,Pabula,Short
Ang Mahiwagang Gubat ng Mga Bituin,Pabula,Long
Ang Kaibigan Kong si Ulan,Pabula,Short
Ang Alamat ng Araw at Buwan,Alamat,Short
Si Pipo at ang Nawawalang Laruan,Pabula,Long
Ang Lihim ng Bulaklak na Ginto,Pabula,Long
Ang Pagong at ang Mahiwagang Puno ng Saging,Pabula,Short
Ang Batang Sinuklian ng Buwan,Pabula,Short
Si Lino at ang Prinsipeng Halaman,Pabula,Short
Si Daloy at ang Mahiwagang Batis,Pabula,Long
Ang Lihim ng Bahagharing Bata,Pabula,Long
Ang Matandang Puno at ang Tatlong Mahiwagang Buto,Pabula,Long
Si Maya at ang Duwende sa Loob ng Garapon,Pabula,Short
Si Rico at ang Nawawalang Ulap,Pabula,Short
Si Binhi at ang Mahiwagang Halaman,Pabula,Long
Ang Talisman ni Tomas,Kwentong Bayan,Long
Ang Malaking Pandesal ni Pedro,Pabula,Long
Si Lira at ang Mahiwagang Singsing,Pabula,Long
Ang Lobo at ang Bulaklak na Pilak,Pabula,Long
Ang Kariton ni Kiko,Pabula,Long
Ang Araw na Umulan ng Tsokolate,Pabula,Long
Ang Misteryosong Kahon ni Aling Rosa,Pabula,Long
Si Amihan at ang Puno ng Hangin,Pabula,Short
Ang Paboritong Sapatos ni Lila,Pabula,Long
Si Titing at ang Batang Bituin,Pabula,Long
Ang Bahaghari ni Mila,Pabula,Short
Si Kikoy at ang Alitaptap,Pabula,Short
Ang Paglalakbay ni Susi at ang Aklat ng mga Salita,Pabula,Long
Ang Lihim ng Bahay na Bato,Pabula,Long
Si Lino at ang Mahiwagang Singsing,Pabula,Long
Ang Nawawalang Kalapati ni Marikit,Pabula,Long
Ang Araw na Naging Kaibigan ni Buboy ang Ibon,Pabula,Long
Ang Mahiwagang Tambuli ni Kaloy,Pabula,Long
Si Pipay at ang Lihim na Pintuan,Pabula,Long
Ang Lapis ni Lala,Pabula,Long
Ang Munting Prinsipe ng Isla Malaya,Kwentong Bayan,Long
Ang Lihim ng Gintong Parol,Pabula,Short
Ang Kabayo ng Pangarap ni Miguel,Pabula,Short
Si Tonton at ang Bulaklak ng Pag-asa,Pabula,Short
Ang Buwan at ang Bituin ni Amira,Pabula,Short
Si Tikoy at ang Mahiwagang Payong,Pabula,Long
Ang Maliliit na Puno ni Benjie,Pabula,Long
Ang Pakpak ni Nina,Pabula,Long
Ang Kuwintas ni Rosas,Pabula,Short
Si Sining at ang Mahiwagang Pintura,Pabula,Long
Ang Mahiwagang Sapatos ni Lino,Pabula,Short
Ang Halaman ng Kabutihan ni Aling Mirasol,Pabula,Short
Si Luntian at ang Diwata ng Kalikasan,Pabula,Long
Ang Paglalakbay ni Bato,Pabula,Short
Ang Nawawalang Parol ni Ella,Pabula,Long
Si Marikit at ang Ginintuang Panaginip,Pabula,Long
Ang Lihim ng Bahagharing Hardin,Kwentong Bayan,Long
Si Matmat at ang Gintong Palasyo ng mga Daga,Pabula,Long
Ang Mahiwagang Pluma ni Lira,Pabula,Long
Si Tori at ang Mga Kulay ng Mundo,Pabula,Long
Ang Mahiwagang Lapis ni Pedro,Pabula,Long
Si Lila at ang Munting Buwan,Pabula,Short
Ang Nawala sa Dagat ni Pio,Pabula,Short
Si Lunti at ang Singsing ng Bundok,Pabula,Long
Ang Paglalakbay ni Manang at ang Pulang Aso,Pabula,Long
Si Dako at ang Alamat ng Mga Bituin,Alamat,Long
Si Ina at ang Mahiwagang Lobo,Pabula,Long
Ang Alamat ng Kulay ng Hapon,Alamat,Long
Si Enzo at ang Araw ng Mga Hangin,Pabula,Long
Ang Mahiwagang Sapatos ni Lila,Pabula,Long
Ang Nawawalang Kidlat ni Tato,Pabula,Short
Si Pito at ang Araw ng Pangarap,Pabula,Long
Ang Lihim ng Mga Kulay ng Bulaklak,Pabula,Long
Si Pedro at ang Nawawalang Ulan,Pabula,Long
Ang Kaibigan ni Liwanag,Pabula,Long
Ang Puno ng Pag-asa,Pabula,Long
Si Nilo at ang Nawawalang Bahaghari,Pabula,Long
Ang Mahiwagang Alamat ng Kabibe,Alamat,Short
Ang Hiwaga ng Batong Umiilaw,Pabula,Short
Ang Lihim ni Ilog Maligaya,Pabula,Long
Ang Alamat ng Palaka at ng Kanyang Gintong Korona,Alamat,Long
Ang Singsing ng Karunungan ni Lito,Pabula,Long
Ang Mahiwagang Pintuan ni Kiko,Pabula,Long
Ang Mahiwagang Hikaw ni Liza,Pabula,Short
Ang Nawawalang Kampanilya ni Mariang Uwak,Pabula,Long
Ang Alamat ng Munting Parol,Alamat,Short
Ang Sikretong Hardin ng Mga Engkanto,Kwentong Bayan,Long
Ang Paglalakbay ni Pio at ng Mapagkalingang Araw,Pabula,Short
Ang Aso at ang Nawawalang Buwan,Pabula,Long
Ang Prinsesa at ang Halimaw ng Dagat,Pabula,Long
Si Berto at ang Mahiwagang Sapatos,Pabula,Short
Ang Malaking Bato sa Daan,Pabula,Short
Ang Alamat ng Naghihintay na Bituin,Alamat,Long
Si Luningning at ang Bulaklak ng Pag-asa,Pabula,Short
Ang Paglalakbay ng Maliliit na Anino,Pabula,Short
Ang Hiling ng Bahaghari,Pabula,Short
Ang Mahiwagang Puno ng Luntian,Pabula,Short
Si Nilo at ang Gintong Pating,Pabula,Short
Ang Lihim ng Tagong Paraiso,Pabula,Long
Si Luntiang Palaka at ang Nawawalang Ilog,Pabula,Short
Ang Alitaptap na Nagbigay ng Liwanag,Pabula,Short
Ang Mahiwagang Pakpak ni Lola Pilar,Pabula,Short
Ang Batang Walang Takot sa Mga Anino,Pabula,Long
Ang Kabayong Pula na Hindi Marunong Tumakbo,Pabula,Long
Ang Kambal na Diwatang Sapa at Ulap,Pabula,Long
Si Anya at ang Mahiwagang Bulaklak,Pabula,Short
Ang Bagwis ng Kabutihan,Pabula,Short
Ang Mahiwagang Kidlat ni Liway,Pabula,Long
Ang Alitaptap at ang Nawawalang Sining,Pabula,Long
Ang Hiwaga ng Buhok ni Sima,Pabula,Long
Ang Araw na Hindi Sumikat,Kwentong Bayan,Long
Ang Bulong ng Hangin sa Dapithapon,Kwentong Bayan,Long
Ang Paglalakbay ni Tala at ang Nawawalang Buwan,Pabula,Long
Ang Susi sa Bundok ng Mga Pangarap,Pabula,Long
Ang Tagapagbantay ng Araw at Buwan,Pabula,Long
Ang Diwata ng Makulay na Bahaghari,Pabula,Long
Ang Puno ng Kaalaman,Pabula,Long
Si Pilandok at ang Mahiwagang Sapa,Pabula,Long
Ang Mahiwagang Tambol ni Kiko,Pabula,Long
Ang Alamat ng Nawawalang Ibon,Alamat,Long
Si Maya at ang Mahiwagang Sampaguita,Pabula,Long
Ang Huling Bituin ng Taglamig,Pabula,Long
Si Bantay at ang Mahiwagang Balon,Pabula,Long
Si Tala at ang Mahiwagang Araw,Pabula,Long
Ang Alamat ng Higanteng Bayabas,Alamat,Long
Si Lola Basi at ang mga Bituin,Pabula,Long
Si Amihan at ang Alamat ng Hangin,Alamat,Long
Ang Batang Mangingisda at ang Prinsesa ng Dagat,Pabula,Long
Ang Puno ng Talisay at ang Lihim na Paraan ng Pag-asa,Pabula,Long
Si Kuting at ang Nawawalang Kulay ng Bahaghari,Pabula,Short
Ang Alamat ng Makulay na Palaka,Alamat,Short
Ang Lihim ni Mang Pedro at ang Kendi ng Buhay,Pabula,Short
Si Tisoy at ang Kulay ng Hangin,Pabula,Long
Ang Alamat ng Mga Bituin sa Dagat,Alamat,Long
Ang Mahiwagang Palasyo sa Loob ng Gubat,Pabula,Short
Si Luningning at ang Lihim ng Kumukutitap na Kabute,Pabula,Short
Ang Paglalakbay ni Lando at ang Puno ng mga Pangarap,Pabula,Long
Ang Mahiwagang Suso ni Amihan,Kwentong Bayan,Long
Si Kaloy at ang Lihim ng Gintong Sampaguita,Kwentong Bayan,Short
Ang Tindahan ni Lola Terya at ang Mahiwagang Biskwit,Kwentong Bayan,Long
Si Maya at ang Mga Palasyong Ulap,Kwentong Bayan,Long
Ang Mahiwagang Bato ni Danding,Kwentong Bayan,Long
Ang Alamat ng Munting Mga Alitaptap,Alamat,Long
Si Arman at ang Itim na Kabayo ng Kapatagan,Kwentong Bayan,Long
Ang Prinsesa ng Niyebe at ang Nawawalang Diwata,Kwentong Bayan,Short
Ang Paglalakbay ni Toti sa Bundok ng Mga Sirena,Kwentong Bayan,Long
Si Kaida at ang Lihim ng Bagong Umaga,Kwentong Bayan,Short
Ang Palasyo sa Ilalim ng Dagat,Kwentong Bayan,Long
Ang Hiwaga ng Lumang Aklatan,Kwentong Bayan,Long
Ang Mahiwagang Susi ni Abet,Kwentong Bayan,Long
Si Pipay at ang Hiwagang Puno ng Ibon,Kwentong Bayan,Short
Ang Kuwento ni Likha at ang Alamat ng Bulaklak ng Hangin,Alamat,Short
Ang Mahiwagang Huni ni Tandang Karlo,Kwentong Bayan,Long
Ang Paglalakbay ni Dalisay sa Lawa ng Alon,Kwentong Bayan,Long
Si Liwayway at ang Araw ng Mahika,Kwentong Bayan,Long
Ang Lihim ng Gintong Kweba,Kwentong Bayan,Long
Ang Mga Bituin ni Luningning,Kwentong Bayan,Short
Ang Sikreto ng Mahiwagang Kawayan,Kwentong Bayan,Long
Si Pilandok at ang Tatlong Salamin ng Liwanag,Kwentong Bayan,Short
Ang Pangarap ni Sining,Kwentong Bayan,Long
Si Batingaw at ang Hiwaga ng Kampana,Kwentong Bayan,Long
Ang Halamanan ni Aling Luntian,Kwentong Bayan,Long
Ang Batang May Gintong Puso,Kwentong Bayan,Short
Ang Kuwento ng Nagsasalitang Bato,Kwentong Bayan,Short
Ang Lihim ng Araw at Buwan,Alamat,Short
Ang Kabayo ni Mang Tano,Kwentong Bayan,Short
Ang Batang Nagligtas sa Bagyo,Kwentong Bayan,Short
Si Bino at ang Halimaw sa Ilog,Kwentong Bayan,Long
Si Tikboy at ang Matandang Mangkukulam,Kwentong Bayan,Long
Ang Nawawalang Kendi ni Lito,Kwentong Bayan,Long
Ang Susi sa Lihim na Kaharian,Kwentong Bayan,Long
Si Kapitang Bayani at ang Mga Magnanakaw,Kwentong Bayan,Long
Ang Magkaibigang Kabibe at Pagong,Pabula,Short
Ang Mahiwagang Puno ng Luntian,Kwentong Bayan,Long
Ang Lihim ng Palasong Ginto,Kwentong Bayan,Long
Ang Sirena at ang Nawawalang Bituin,Kwentong Bayan,Short
Si Kuya Bunso at ang Paglalakbay sa Bundok,Kwentong Bayan,Short
Ang Mahiwagang Bangka ni Lolo Berto,Kwentong Bayan,Long
Ang Kuwento ni Mayang Mapagbigay,Pabula,Short
Ang Gintong Susi ni Andres,Kwentong Bayan,Short
Ang Palaka at ang Nawawalang Tunog ng Gubat,Pabula,Short
Ang Alamat ng Pugad ng Agila,Alamat,Short
Ang Mahiwagang Takip ng Buwan,Kwentong Bayan,Short
Ang Araw at ang Munting Alitaptap,Pabula,Short
Si Karding at ang Mahikang Pagkain,Kwentong Bayan,Short
Ang Pagong at ang Haring Buwan,Pabula,Long
Ang Matapang na Saging at ang Halimaw ng Kagubatan,Pabula,Short
Ang Kuwento ng Mahiwagang Kabibe,Kwentong Bayan,Short
Si Lino at ang Nawawalang Hangin,Kwentong Bayan,Short
Ang Alamat ng Pulang Mangga,Alamat,Long
Ang Kuwento ng Batang Ginto,Kwentong Bayan,Short
Ang Kaibigan ni Tiktik,Kwentong Bayan,Short
Ang Misteryo ng Mga Bituin,Kwentong Bayan,Short
Si Kaloy at ang Nawawalang Puno,Kwentong Bayan,Short
Ang Karera ni Bantay at ni Sisi,Pabula,Short
Ang Alamat ng Buhangin sa Isla ni Pepe,Alamat,Short
